104,out,out,out,WoS,.,J,"Eckert, Ryan J.; Studivan, Michael S.; Voss, Joshua D.","Eckert, Ryan J.; Studivan, Michael S.; Voss, Joshua D.",Populations of the coral species Montastraea cavernosa on the Belize Barrier Reef lack vertical connectivity,.,.,"Larval connectivity among and within coral reefs is important for sustaining coral metapopulations, enhancing ecosystem resilience through species and genetic diversity, and maintaining reef ecosystems' structure and functions. This study characterized genetic structure and assessed horizontal and vertical connectivity among populations of the ubiquitous gonochoric broadcast spawning coral Montastraea cavernosa in Belize. Using nine polymorphic microsatellite loci, we genotyped M. cavernosa colonies from four depth zones at four study sites within Belizean marine management zones. Study sites were selected within South Water Caye Marine Reserve (3 sites) and Glover's Reef Marine Reserve (1 site). Strong contemporary genetic differentiation was observed between relatively shallow M. cavernosa populations (10 m, 16 m) and relatively deep (25 m, 35 m) populations, coinciding with a transition from reef crest to reef slope. These results were consistent across both marine reserves. Vertical and horizontal migration models suggest that all populations were historically panmictic, with little unidirectional migration. The relative local isolation of shallow and mesophotic M. cavernosa populations in Belize, coupled with the importance of Belize's upper mesophotic populations as potential larval sources for other areas in the Tropical Western Atlantic, reinforces the need for management strategies that conserve coral populations across all depth zones.",8,2019,10.1038/s41598-019-43479-x,WOS:000467543700015,.,.,.,.,.,.,,.,.,.,.,,.,.,.,.,.,.,.,.,.,.,.,.,.,connectivity,.,.,.,.,.,.,.,,.,,.,.,.,.,,,.,,.,,.,.,.,.,,,,no control
105,in,out,out,WoS,yes,J,"Kazanidis, Georgios; Vad, Johanne; Henry, Lea-Anne; Neat, Francis; Berx, Barbara; Georgoulas, Konstantinos; Roberts, J. Murray","Kazanidis, Georgios; Vad, Johanne; Henry, Lea-Anne; Neat, Francis; Berx, Barbara; Georgoulas, Konstantinos; Roberts, J. Murray",Distribution of Deep-Sea Sponge Aggregations in an Area of Multisectoral Activities and Changing Oceanic Conditions,.,.,"Discovery and understanding of fragile deep-sea habitats like sponge aggregations, are being outpaced by anthropogenic resource exploitation. Sustainable ocean development in the Faroe-Shetland Channel Nature Conservation Marine Protected Area (FSC NCMPA; northeast Atlantic), which harbors sponge aggregations, now requires adaptive management in the face of encroachment of multisectorial activities in this area (e.g., fishing, oil and gas, shipping) and climate change. We examined sponge morphotype composition, richness, diversity, density and body-size distribution inside and outside the FSC NCMPA, and the role of environmental variability and human impact in these sponge aggregations. Analyses were based on the examination of 465 high resolution images from 13 towed-camera transects. A catalog for regional sponge morphotypes was also developed and applied for these analyses. Analysis revealed that morphotype composition did not differ between inside and outside the FSC NCMPA but richness, diversity and densities of massive/spherical/papillate and flabellate/caliculate sponges were higher inside than outside the boundary. The sponge aggregations occurred within a narrow zone between 450 and 530 m depth, within relatively warm and saline water masses. Furthermore, multiple size cohorts of sponges were recorded inside the FSC NCMPA, in contrast to the single cohort outside. Distance-based linear modeling showed that demersal fisheries, substratum, salinity and temperature explained a statistically-significant amount of variation (48%, p < 0.001) of sponge density across the study area. Findings on density and size cohorts suggest that the FSC NCMPA boundary currently encloses the most vulnerable area, which also demonstrates normal ecosystem functions (e.g., recruitment). However, sponges were constrained to a narrow environmental niche shaped by fisheries and interactions of FSC NCMPA water masses with the slope that in turn likely determine, food supply to the sponge aggregations. Our study illustrated the vulnerability of the FSC NCMPA sponge aggregations to fisheries and changes to water mass properties over time. The morphotype catalog and suite of indicators (i.e., density and body-size distribution) allow for baseline and future assessments of anthropogenic and climate change impacts on sponge aggregations' environmental status in the FSC NCMPA, thus guiding management as sectoral encroachment continues in this area.",13,2019,10.3389/fmars.2019.00163,WOS:000465441700001,field,.,.,.,.,.,,.,.,.,.,,.,.,.,.,.,.,.,.,.,.,.,.,.,connectivity,.,.,.,.,.,.,.,,.,,.,.,.,.,,,.,,.,,.,.,.,.,,,,not about connectivity
106,out,out,out,WoS,.,J,"Paletta, Maria Grazia; Grinyo, Jordi; Gili, Josep-Maria; Diaz, David; Munoz, Anabel; Garrabou, Joaquim; Abbiati, Marco; Ledoux, Jean-Baptiste; Costantini, Federica","Paletta, Maria Grazia; Grinyo, Jordi; Gili, Josep-Maria; Diaz, David; Munoz, Anabel; Garrabou, Joaquim; Abbiati, Marco; Ledoux, Jean-Baptiste; Costantini, Federica",Exploring the genetic diversity and the population structure of the mesophotic Paramuricea macrospina in the Menorca Channel,.,.,"Gorgonians play an important structural and functional role promoting high diversity and biomass of associated fauna. Up to now, studies on gorgonian ecology in the Mediterranean Sea have been focused mainly on the SCUBA diving depth range. Although increased availability of remotely operated vehicles allowed access to the deeper areas, gorgonian assemblages located on continental shelf and slopes are still barely known. Gorgonian assemblages on continental shelves are extremely vulnerable to anthropogenic impacts, especially bottom trawling and longline fishing. To implement effective management and conservation policies it is crucial to understand patterns of genetic structure among populations since connectivity enhances the resilience of populations. Paramuricea macrospina is a key structuring gorgonian in the Menorca Channel's (Balearic Archipelago) outer continental shelf where it covers vast extensions, reaching very high densities. Combining two mitochondrial makers and 10 microsatellites, this study gives the first insight into the genetic diversity and population structure of P. macrospina between 60 and 100 m depth in the Menorca Channel and at a horizontal spatial scale of about 60 Km. Overall, we demonstrate a low genetic diversity and a lack of genetic structure among populations, which may be explained by the geomorphology and hydrodynamic features of the Menorca Channel (e.g. internal waves, high currents). Our study suggests some connectivity among P. macrospina populations in accordance with the high recruitment rates observed. This connectivity may increase the resilience and foster the recovery of impacted populations since the study area will become a Marine Protected Area of the Natura 2000 network in the near future. Nevertheless, complementary studies based on a larger sample size should be conducted to complement our results. In addition, temporal genetic monitoring of these populations should be envisaged to monitor the potential reduction of genetic diversity of this mesophotic species.",2,2019,10.1016/j.ecss.2019.02.024,WOS:000462100000042,.,.,.,.,.,.,,.,.,.,.,,.,.,.,.,.,.,.,.,.,.,.,.,.,connectivity,.,.,.,.,.,.,.,,.,,.,.,.,.,,,.,,.,,.,.,.,.,,,,no MPA
107,out,out,out,WoS,.,J,"Angel Cisneros-Mata, Miguel; Munguia-Vega, Adrian; Rodriguez-Felix, Demetrio; Alberto Aragon-Noriega, Eugenio; Manuel Grijalva-Chon, Jose; Alfredo Arreola-Lizarraga, Jose; Hurtado, Luis A.","Angel Cisneros-Mata, Miguel; Munguia-Vega, Adrian; Rodriguez-Felix, Demetrio; Alberto Aragon-Noriega, Eugenio; Manuel Grijalva-Chon, Jose; Alfredo Arreola-Lizarraga, Jose; Hurtado, Luis A.","Genetic diversity and metapopulation structure of the brown swimming crab (Callinectes bellicosus) along the coast of Sonora, Mexico: Implications for fisheries management",.,.,"Management of commercial fisheries resources is commonly done assuming that populations are spatially homogeneous throughout their geographic range. However, uneven gene flow can result in gradients of genetic diversity that can affect population dynamics and management reference points and may contribute to over-fishing. We examined whether the brown swimming crab, Callinectes bellicosus, fished along 1200 km on the coast of Sonora (Mexico) is a homogeneous population. Based on previous empirical evidence of differences in phenology, we hypothesized that C. bellicosus has a metapopulation structure which needs to be included in management tools. We conducted a genetic study of C. bellicosus taken at seven sites along the coast of Sonora and obtained their microsatellite genotypes. Recent gene flow, as well as the role of each site as source or sink, were investigated. We found a latitudinal gradient in genetic diversity and identified sites along the coast acting as sources or sinks of migrants. Central sites act as sources, while northern sites are sinks; the main source of migrants was the southern-most site. A predominantly asymmetric metapopulation structure composed of local populations with moderate connectivity may be explained by larval dispersal in the northward oceanic current during the spawning period. Including migration rates between sites in a metapopulation dynamics model of C. bellicosus and considering that fishing and management decisions in source populations will impact neighboring populations located downstream can improve current management of this important commercial fishery.",6,2019,10.1016/j.fishres.2018.11.021,WOS:000458939000013,.,.,.,.,.,.,,.,.,.,.,,.,.,.,.,.,.,.,.,.,.,.,.,.,connectivity,.,.,.,.,.,.,.,,.,,.,.,.,.,,,.,,.,,.,.,.,.,,,,no MPA
108,in,out,out,WoS,yes,J,"Baetscher, Diana S.; Anderson, Eric C.; Gilbert-Horvath, Elizabeth A.; Malone, Daniel P.; Saarman, Emily T.; Carr, Mark H.; Garza, John Carlos","Baetscher, Diana S.; Anderson, Eric C.; Gilbert-Horvath, Elizabeth A.; Malone, Daniel P.; Saarman, Emily T.; Carr, Mark H.; Garza, John Carlos",Dispersal of a nearshore marine fish connects marine reserves and adjacent fished areas along an open coast,.,.,"Marine species with pelagic larvae typically exhibit little population structure, suggesting long-distance dispersal and high gene flow. Directly quantifying dispersal of marine fishes is challenging but important, particularly for the design of marine protected areas (MPAs). Here, we studied kelp rockfish (Sebastes atrovirens) sampled along similar to 25 km of coastline in a boundary current-dominated ecosystem and used genetic parentage analysis to identify dispersal events and characterize them, because the distance between sedentary parents and their settled offspring is the lifetime dispersal distance. Large sample sizes and intensive sampling are critical for increasing the likelihood of detecting parent-offspring matches in such systems and we sampled more than 6,000 kelp rockfish and analysed them with a powerful set of 96 microhaplotype markers. We identified eight parent-offspring pairs with high confidence, including two juvenile fish that were born inside MPAs and dispersed to areas outside MPAs, and four fish born in MPAs that dispersed to nearby MPAs. Additionally, we identified 25 full-sibling pairs, which occurred throughout the sampling area and included all possible combinations of inferred dispersal trajectories. Intriguingly, these included two pairs of young-of-the-year siblings with one member each sampled in consecutive years. These sibling pairs suggest monogamy, either intentional or accidental, which has not been previously demonstrated in rockfishes. This study provides the first direct observation of larval dispersal events in a current-dominated ecosystem and direct evidence that larvae produced within MPAs are exported both to neighbouring MPAs and to proximate areas where harvest is allowed.",15,2019,10.1111/mec.15044,WOS:000474808300005,field,.,.,.,.,.,,.,.,.,.,,.,.,.,.,.,.,.,.,.,.,.,.,.,connectivity,.,.,.,.,.,.,.,,.,,.,.,.,.,,,.,,.,,.,.,.,.,,,,no control
109,out,out,out,WoS,.,J,"Bernard, Andrea M.; Finnegan, Kimberly A.; Shivji, Mahmood S.","Bernard, Andrea M.; Finnegan, Kimberly A.; Shivji, Mahmood S.","Genetic connectivity dynamics of the giant barrel sponge, Xestospongia muta, across the Florida Reef Tract and Gulf of Mexico",.,.,"Resolving the genetic connectivity of coral reef taxa is necessary to understand the community dynamics of these increasingly threatened ecosystems. Herein, we assess the fine scale genetic connectivity of six populations of the Atlantic giant barrel sponge, Xestospongia muta (Schmidt, 1870), using microsatellite markers. This survey included populations from across the Florida Reef Tract and the Gulf of Mexico, including sponges from the Pulley Ridge Habitat Area of Particular Concern, a mesophotic coral reef located approximately 250 km from Florida's (USA) southwestern coast, and the Flower Garden Banks National Marine Sanctuary, the northernmost western Atlantic coral reef ecosystem. Overall, significant population structure was found (FST = 0.020, 95% CI: 0.011-0.031), with X. muta individuals from the Flower Garden Banks showing the highest levels of genetic differentiation relative to all other surveyed populations (FST > 0.048). Despite the high levels of population structuring observed, some horizontal and/or vertical connectivity was found between neighboring reef systems, including evidence of gene flow between mesophotic (Pulley Ridge Habitat of Particular Concern) and photic (Dry Tortugas) reef tracts. Furthermore, largely negligible levels of first-generation migration among discrete genetic populations was observed, suggesting that the persistence of most populations of X. muta is highly dependent on selfrecruitment. Thus, while the Pulley Ridge mesophotic reef may provide sponge recruits to shallow photic reefs, its role as a potential refuge and propagule source appears limited to only small geographic scales.",1,2019,10.5343/bms.2018.0021,WOS:000475493600003,.,.,.,.,.,.,,.,.,.,.,,.,.,.,.,.,.,.,.,.,.,.,.,.,connectivity,.,.,.,.,.,.,.,,.,,.,.,.,.,,,.,,.,,.,.,.,.,,,,no MPA
110,in,out,out,WoS,yes,J,"Damiano, Matthew D.; Wilberg, Michael J.","Damiano, Matthew D.; Wilberg, Michael J.","Population dynamics of eastern oysters in the Choptank River Complex, Maryland during 1989-2015",.,.,"The eastern oyster (Crassostrea virginica) fishery in the Choptank River Complex (CRC), Maryland supports a large fishery. The CRC is also host to some of the largest oyster restoration projects in the world. Yet the relative effects of harvest and restoration on the population dynamics of eastern oyster in the CRC have not been assessed. We developed stage-based population models for each region of the CRC in AD Model Builder using dredge survey and harvest data provided by Maryland Department of Natural Resources from 1989 to 2015. Patterns in exploitation rates over time varied among regions. Abundance generally decreased during 1989-2003 and increased thereafter. Recruitment was greatest in the late 1990s, 2010, and 2012, which led to increases in abundance. Natural mortality was low across all regions during 2004-2015. Habitat, recruitment, and abundance declined 50-70% during 1989-2015, but fishery effort increased in years with higher abundance.",4,2019,10.1016/j.fishres.2018.12.023,WOS:000458939000024,model,.,.,.,.,.,,.,.,.,.,,.,.,.,.,.,.,.,.,.,.,.,.,.,connectivity,.,.,.,.,.,.,.,,.,,.,.,.,.,,,.,,.,,.,.,.,.,,,,"analyses trends in mortality,  abundance, recruitment over time "
111,in,out,out,WoS,yes,J,"Manel, Stephanie; Loiseau, Nicolas; Andrello, Marco; Fietz, Katharina; Goni, Raquel; Forcada, Aitor; Lenfant, Philippe; Kininmonth, Stuart; Marcos, Concepcion; Marques, Virginie; Mallol, Sandra; Perez-Ruzafa, Angel; Breusing, Corinna; Puebla, Oscar; Mouillot, David","Manel, Stephanie; Loiseau, Nicolas; Andrello, Marco; Fietz, Katharina; Goni, Raquel; Forcada, Aitor; Lenfant, Philippe; Kininmonth, Stuart; Marcos, Concepcion; Marques, Virginie; Mallol, Sandra; Perez-Ruzafa, Angel; Breusing, Corinna; Puebla, Oscar; Mouillot, David",Long-Distance Benefits of Marine Reserves: Myth or Reality?,.,.,"Long-distance (>40-km) dispersal from marine reserves is poorly documented; yet, it can provide essential benefits such as seeding fished areas or connecting marine reserves into networks. From a meta-analysis, we suggest that the spatial scale of marine connectivity is underestimated due to the limited geographic extent of sampling designs. We also found that the largest marine reserves (>1000 km(2)) are the most isolated. These findings have important implications for the assessment of evolutionary, ecological, and socio-economic long-distance benefits of marine reserves. We conclude that existing methods to infer dispersal should consider the up-to-date genomic advances and also expand the spatial scale of sampling designs. Incorporating long-distance connectivity in conservation planning will contribute to increase the benefits of marine reserve networks.",19,2019,10.1016/j.tree.2019.01.002,WOS:000461826200010,review,.,.,.,.,.,,.,.,.,.,,.,.,.,.,.,.,.,.,.,.,.,.,.,connectivity,.,.,.,.,.,.,.,,.,,.,.,.,.,,,.,,.,,.,.,.,.,,,,not relevant
112,out,out,out,WoS,.,J,"Santin, A.; Grinyo, J.; Ambroso, S.; Uriz, M. J.; Dominguez-Carrio, C.; Gili, J. M.","Santin, A.; Grinyo, J.; Ambroso, S.; Uriz, M. J.; Dominguez-Carrio, C.; Gili, J. M.",Distribution patterns and demographic trends of demosponges at the Menorca Channel (Northwestern Mediterranean Sea),.,.,"Nowadays, there is still a huge lack of knowledge regarding the morphology and size structure of sponge populations and their possible ecological implications. This study assesses, by means of quantitative analyses of video transects and morphometric analyses on still photographs, the geographical, bathymetrical and size-structure distribution of the most relevant habitat-forming sponge species on the continental shelf and the upper slope of the Menorca Channel, an area soon to be declared a Marine Protected Area (MPA) as part of the Natura 2000 Network. Additionally, the influence of seafloor variables on the observed distribution patterns was evaluated. Highest sponge densities and abundances were concentrated in areas of high hydrodynamism, namely the rocky shoals offshore Cap Formentor and the Menorca Canyon's head. Most of the studied species were dominated by small to medium size classes, suggesting pulse recruitment events. A clear depth-zonation pattern has been observed, going from the inner continental shelf to the upper slope. At the same time, the continental shelf harbored the presence of diverse and contrasting growth morphologies, yet the biggest forms occurred at the shelf edge and the upper slope. This study highlights the presence of dense, well-preserved sponge populations in the Menorca Channel, and provides a baseline for their future monitoring once the MPA is declared, potentially serving as reference for other areas across the Atlanto-Mediterranean region.",8,2019,10.1016/j.pocean.2019.02.002,WOS:000471739000002,.,.,.,.,.,.,,.,.,.,.,,.,.,.,.,.,.,.,.,.,.,.,.,.,connectivity,.,.,.,.,.,.,.,,.,,.,.,.,.,,,.,,.,,.,.,.,.,,,,not relevant
113,in,out,.,WoS,yes,J,Jouval,"Jouval, Florian; Latreille, Anne Catherine; Bureau, Sophie; Adjeroud, Mehdi; Penin, Lucie",Multiscale variability in coral recruitment in the Mascarene Islands: From centimetric to geographical scale,.,.,"Coral recruitment refers to the processes allowing maintenance and renewal of coral communities. Recruitment success is therefore indispensable for coral reef recovery after disturbances. Recruitment processes are governed by a variety of factors occurring at all spatial and temporal scales, from centimetres to hundreds of kilometres. In the present context of rising disturbances, it is thus of major importance to better understand the relative importance of different scales in this variation, and when possible, the factors associated with these scales. Multiscale spatio-temporal variability of scleractinian coral recruitment was investigated at two of the Mascarene Islands: Reunion and Rodrigues. Recruitment rates and taxonomic composition were examined during three consecutive six-month periods from regional to micro-local scales (i. e. from hundreds of kilometres to few centimetres) and between two protection levels (no-take zones and general protection zones). Very low recruitment rates were observed. Rodrigues displayed lower recruitment rates than Reunion. Recruit assemblage was dominated by Pocilloporidae (77.9%), followed by Acroporidae (9.9%) and Poritidae (5.2%). No protection effect was identified on coral recruitment, despite differences in recruitment rates among sites within islands. Recruits were patchily distributed within sites but no aggregative effect was detected, i. e. the preferentially colonised tiles were not spatially grouped. Recruits settled mainly on the sides of the tiles, especially at Rodrigues, which could be attributed to the high concentration of suspended matter. The variability of recruitment patterns at various spatial scales emphasises the importance of micro-to macro-local variations of the environment in the dynamics and maintenance of coral populations. High temporal variability was also detected, between seasons and years, which may be related to the early 2016 bleaching event at Rodrigues. The low recruitment rates and the absence of protection effect raise questions about the potential for recovery from disturbances of coral reefs in the Mascarene Islands.",1,2019,10.1371/journal.pone.0214163,WOS:000462000400040,field,CI,2015-2017,MPA,Reserve Naturelle Marine de La Reunion NTZs,10,medium,2007,fully,2.1,35,medium,NA,France,tropical,Africa,Indian Ocean,coral reef,invertebrate,mix,unfished,no,.,.,.,connectivity,.,.,recruitment,Figure 2,neutral,yes,n/m^2,se,35.9649123,120,709.085702,26.62866317,60.3070175,120,818.093601,28.60233559,.,.,.,.,.,.,.,.,.,-0.516904669,0.006442854,control is a PPA
113,in,in,in,WoS,yes,J,Jouval,"Jouval, Florian; Latreille, Anne Catherine; Bureau, Sophie; Adjeroud, Mehdi; Penin, Lucie",Multiscale variability in coral recruitment in the Mascarene Islands: From centimetric to geographical scale,.,.,"Coral recruitment refers to the processes allowing maintenance and renewal of coral communities. Recruitment success is therefore indispensable for coral reef recovery after disturbances. Recruitment processes are governed by a variety of factors occurring at all spatial and temporal scales, from centimetres to hundreds of kilometres. In the present context of rising disturbances, it is thus of major importance to better understand the relative importance of different scales in this variation, and when possible, the factors associated with these scales. Multiscale spatio-temporal variability of scleractinian coral recruitment was investigated at two of the Mascarene Islands: Reunion and Rodrigues. Recruitment rates and taxonomic composition were examined during three consecutive six-month periods from regional to micro-local scales (i. e. from hundreds of kilometres to few centimetres) and between two protection levels (no-take zones and general protection zones). Very low recruitment rates were observed. Rodrigues displayed lower recruitment rates than Reunion. Recruit assemblage was dominated by Pocilloporidae (77.9%), followed by Acroporidae (9.9%) and Poritidae (5.2%). No protection effect was identified on coral recruitment, despite differences in recruitment rates among sites within islands. Recruits were patchily distributed within sites but no aggregative effect was detected, i. e. the preferentially colonised tiles were not spatially grouped. Recruits settled mainly on the sides of the tiles, especially at Rodrigues, which could be attributed to the high concentration of suspended matter. The variability of recruitment patterns at various spatial scales emphasises the importance of micro-to macro-local variations of the environment in the dynamics and maintenance of coral populations. High temporal variability was also detected, between seasons and years, which may be related to the early 2016 bleaching event at Rodrigues. The low recruitment rates and the absence of protection effect raise questions about the potential for recovery from disturbances of coral reefs in the Mascarene Islands.",1,2019,10.1371/journal.pone.0214163,WOS:000462000400040,field,CI,2015-2017,MPA,South East NTZs,8,medium,2009,fully,NA,43.7,NA,NA,Mauritius,tropical,Africa,Indian Ocean,coral reef,invertebrate,mix,unfished,no,,,,connectivity,,recruitment,recruitment,Figure 2,positive,yes,n/m^2,se,12.8873239,80,248.165047,15.75325512,5.28169014,80,89.4911724,9.4599774,.,.,.,.,.,.,.,.,.,0.891998036,0.058777775,.
