200,in,out,out,WoS,yes,J,"Puckett, B. J.; Eggleston, D. B.","Puckett, B. J.; Eggleston, D. B.","Metapopulation dynamics guide marine reserve design: importance of connectivity, demographics, and stock enhancement",.,.,"The concepts of metapopulation persistence and source-sink dynamics are central and often untested tenets of marine reserve networks. Effective application of these concepts to marine reserves is limited by data on demographic rates within reserves and larval connectivity among reserves. Using a network of reserves established to restore eastern oyster (Crassostrea virginica) in Pamlico Sound, North Carolina, USA as our model system, we integrated empirically based demographic rates and regional hydrodynamic-based connectivity estimates within a metapopulation model to (1) evaluate the potential for the reserve network to function as a self-persistent oyster metapopulation, (2) determine the relative importance of demographics vs. connectivity on reserve source-sink dynamics, (3) assess the efficacy of stock enhancement in promoting metapopulation persistence, and (4) evaluate whether application of a Few Large or Several Small reserves-a modification of the Single Large or Several Small concept-promoted greater metapopulation retention of larvae within the reserve network (i.e., local larval retention within reserves + larval connectivity among reserves). The reserve network failed to function as a self-persistent metapopulation, despite exceptional demographic rates within reserves. When considering only larval supply from reserves, local retention and connectivity were insufficient to provide annual replacement (>=similar to 0.25 recruits per adult). Accordingly, reserves contributed to the metapopulation primarily via production, not dispersal, of larvae and reserve source-sink dynamics were influenced more by demographics within reserves, particularly adult growth and survival, than larval connectivity among reserves. Addressing recruitment limitation via stock enhancement was not effective at augmenting projected metapopulation declines. Several small reserves initially promoted greater metapopulation retention of larvae than a few large reserves, however, as the number or area of reserves increased, metapopulation retention was equivalent among designs, suggesting that Few Large and Several Small reserves may be the best network design. Marine reserves can be an effective restoration tool for improving demographic rates within reserve boundaries, but designation of multiple reserves does not guarantee a functional reserve network metapopulation. Both demographics and larval connectivity are important considerations to successful application of metapopulation concepts to the design of reserve networks.",26,2016,10.1002/ecs2.1322,WOS:000378523100012,model,.,.,.,.,.,,.,.,.,.,,.,.,.,.,.,.,.,.,.,.,.,.,.,connectivity,.,.,.,.,.,.,.,,.,,.,.,.,.,,,.,,.,,.,.,.,.,,,,no control
201,out,out,out,WoS,.,J,"Calo, Antonio; Munoz, Irene; Perez-Ruzafa, Angel; Vergara-Chen, Carlos; Antonio Garcia-Charton, Jose","Calo, Antonio; Munoz, Irene; Perez-Ruzafa, Angel; Vergara-Chen, Carlos; Antonio Garcia-Charton, Jose","Spatial genetic structure in the saddled sea bream (Oblada melanura [Linnaeus, 1758]) suggests multi-scaled patterns of connectivity between protected and unprotected areas in the Western Mediterranean Sea",.,.,"Marine protected areas (MPAs) and networks of MPAs are advocated worldwide for the achievement of marine conservation objectives. Although the knowledge about population connectivity is considered fundamental for the optimal design of MPAs and networks, the amount of information available for the Mediterranean Sea is currently scarce. We investigated the genetic structure of the saddled sea bream (Oblada melanura) and the level of genetic connectivity between protected and unprotected locations, using a set of 11 microsatellite loci. Spatial patterns of population differentiation were assessed locally (50-100 km) and regionally (500-1000 km), considering three MPAs of the Western Mediterranean Sea. All values of genetic differentiation between locations (Fst and Jost's D) were non-significant after Bon-ferroni correction, indicating that, at a relatively small spatial scale, protected locations were in general well connected with non-protected ones. On the other hand, at the regional scale, discriminant analysis of principal components revealed the presence of a subtle pattern of genetic heterogeneity that reflects the geography and the main oceanographic features (currents and barriers) of the study area. This genetic pattern could be a consequence of different processes acting at different spatial and temporal scales among which the presence of admixed populations, large population sizes and species dispersal capacity, could play a major role. These outcomes can have important implications for the conservation biology and fishery management of the saddled sea bream and provide useful information for genetic population studies of other coastal fishes in the Western Mediterranean Sea. (C) 2015 Elsevier B.V. All rights reserved.",8,2016,10.1016/j.fishres.2015.12.001,WOS:000370307000004,.,.,.,.,.,.,,.,.,.,.,,.,.,.,.,.,.,.,.,.,.,.,.,.,connectivity,.,.,.,.,.,.,.,,.,,.,.,.,.,,,.,,.,,.,.,.,.,,,,no control
202,out,out,out,WoS,.,J,"Hopf, Jess K.; Jones, Geoffrey P.; Williamson, David H.; Connolly, Sean R.","Hopf, Jess K.; Jones, Geoffrey P.; Williamson, David H.; Connolly, Sean R.",Fishery consequences of marine reserves: short-term pain for longer-term gain,.,.,"Marine reserves are often established in areas that support fisheries. Larval export from reserves is argued to help compensate for the loss of fishable habitat; however, previous modeling studies have focused on long-term equilibrium outcomes. We examined the transient consequences of reserve establishment for fished metapopulations, considering both a well-mixed larval pool and a spatially explicit model based on a coral trout (Plectropomus spp.) metapopulation. When fishing pressure was reallocated relative to the area protected, yields decreased initially, then recovered, and ultimately exceeded pre-reserve levels. However, recovery time was on the order of several years to decades. If fishing pressure intensified to maintain pre-reserve yields, reserves were sometimes unable to support the increased mortality and the metapopulation collapsed. This was more likely when reserves were small, or located peripherally within the metapopulation. Overall, reserves can achieve positive conservation and fishery benefits, but fisheries management complementary to reserve implementation is essential.",24,2016,10.1890/15-0348,WOS:000374840500014,.,.,.,.,.,.,,.,.,.,.,,.,.,.,.,.,.,.,.,.,.,.,.,.,connectivity,.,.,.,.,.,.,.,,.,,.,.,.,.,,,.,,.,,.,.,.,.,,,,not relevant
203,out,out,out,WoS,.,J,"Tugores, M. Pilar; Iglesias, Magdalena; Onate, Dolores; Miguel, Joan","Tugores, M. Pilar; Iglesias, Magdalena; Onate, Dolores; Miguel, Joan","Spatial distribution, sampling precision and survey design optimisation with non-normal variables: The case of anchovy (Engraulis encrasicolus) recruitment in Spanish Mediterranean waters",.,.,"In the Mediterranean Sea, the European anchovy (Engraulis encrasicolus) displays a key role in ecological and economical terms. Ensuring stock sustainability requires the provision of crucial information, such as species spatial distribution or unbiased abundance and precision estimates, so that management strategies can be defined (e.g. fishing quotas, temporal closure areas or marine protected areas MPA). Furthermore, the estimation of the precision of global abundance at different sampling intensities can be used for survey design optimisation. Geostatistics provide a priori unbiased estimations of the spatial structure, global abundance and precision for autocorrelated data. However, their application to non-Gaussian data introduces difficulties in the analysis in conjunction with low robustness or unbiasedness. The present study applied intrinsic geostatistics in two dimensions in order to (i) analyse the spatial distribution of anchovy in Spanish Western Mediterranean waters during the species recruitment season, (ii) produce distribution maps, (iii) estimate global abundance and its precision, (iv) analyse the effect of changing the sampling intensity on the precision of global abundance estimates and, (v) evaluate the effects of several methodological options on the robustness of all the analysed parameters. The results suggested that while the spatial structure was usually non-robust to the tested methodological options when working with the original dataset, it became more robust for the transformed datasets (especially for the log-backtransformed dataset). The global abundance was always highly robust and the global precision was highly or moderately robust to most of the methodological options, except for data transformation. (C) 2016 Elsevier Ltd. All rights reserved.",3,2016,10.1016/j.pocean.2015.12.011,WOS:000378101200012,.,.,.,.,.,.,,.,.,.,.,,.,.,.,.,.,.,.,.,.,.,.,.,.,connectivity,.,.,.,.,.,.,.,,.,,.,.,.,.,,,.,,.,,.,.,.,.,,,,not relevant
204,out,out,out,WoS,.,J,"Twist, Brenton A.; Rayment, William J.; Hepburn, Christopher D.","Twist, Brenton A.; Rayment, William J.; Hepburn, Christopher D.",Movement patterns of adult scallops (Pecten novaezealandiae) within a customary fisheries reserve: Implications for fine scale spatial management,.,.,"The endemic scallop (Pecten novaezealandiae) is patchily distributed around New Zealand's coastline and supports customary, recreational and commercial harvest. Little information exists on post-settlement movement patterns of this species, which if significant, could impact their distribution, thus influencing the effectiveness of spatial refuges to fishing such as rahui (fisheries closure). The movements of P. novaezealandiae were examined within adult scallop habitat in a customary fisheries reserve, Te Whaka Te Wera (Paterson Inlet) Mataitai, Raldura (Stewart Island), New Zealand, by tracking the dispersal of tagged scallops from a central release point over two months. The average distance moved, calculated from recovered scallops, was 1.82 m per month, and these movement rates did not differ between the five sites or the two size classes examined. No significant directional movement was observed. The distribution of adult scallops is unlikely to be significantly affected by the scale of random movement observed. Once P. novaezealandiae are settled in appropriate habitat they are likely to only move in response to potential predators. Any spatial refuge created through management intervention, is likely to have positive effects through enhanced larval recruitment due to protection of breeding aggregations, not through movement of adults. The proposed reopening of the scallop fishery to hand collection with a prohibition on underwater breathing apparatus would maintain a deep water refuge for adult scallops, with potential benefits for adjacent fished shallow habitats through larval export. (C) 2015 Elsevier B.V. All rights reserved.",3,2016,10.1016/j.fishres.2015.09.020,WOS:000367700000018,.,.,.,.,.,.,,.,.,.,.,,.,.,.,.,.,.,.,.,.,.,.,.,.,connectivity,.,.,.,.,.,.,.,,.,,.,.,.,.,,,.,,.,,.,.,.,.,,,,not relevant
205,out,out,out,WoS,.,J,"Eastwood, Erin K.; Lopez, Elora H.; Drew, Joshua A.","Eastwood, Erin K.; Lopez, Elora H.; Drew, Joshua A.",Population Connectivity Measures of Fishery-Targeted Coral Reef Species to Inform Marine Reserve Network Design in Fiji,.,.,"Coral reef fish serve as food sources to coastal communities worldwide, yet are vulnerable to mounting anthropogenic pressures like overfishing and climate change. Marine reserve networks have become important tools for mitigating these pressures, and one of the most critical factors in determining their spatial design is the degree of connectivity among different populations of species prioritized for protection. To help inform the spatial design of an expanded reserve network in Fiji, we used rapidly evolving mitochondrial genes to investigate connectivity patterns of three coral reef species targeted by fisheries in Fiji: Epinephelus merra (Serranidae), Halichoeres trimaculatus (Labridae), and Holothuria atra (Holothuriidae). The two fish species, E. merra and Ha. trimaculatus, exhibited low genetic structuring and high amounts of gene flow, whereas the sea cucumber Ho. atra displayed high genetic partitioning and predominantly westward gene flow. The idiosyncratic patterns observed among these species indicate that patterns of connectivity in Fiji are likely determined by a combination of oceanographic and ecological characteristics. Our data indicate that in the cases of species with high connectivity, other factors such as representation or political availability may dictate where reserves are placed. In low connectivity species, ensuring upstream and downstream connections is critical.",5,2016,10.1038/srep19318,WOS:000368815000001,.,.,.,.,.,.,,.,.,.,.,,.,.,.,.,.,.,.,.,.,.,.,.,.,connectivity,.,.,.,.,.,.,.,,.,,.,.,.,.,,,.,,.,,.,.,.,.,,,,no MPA
206,in,out,out,WoS,yes,J,"Bonin, Mary C.; Harrison, Hugo B.; Williamson, David H.; Frisch, Ashley J.; Saenz-Agudelo, Pablo; Berumen, Michael L.; Jones, Geoffrey P.","Bonin, Mary C.; Harrison, Hugo B.; Williamson, David H.; Frisch, Ashley J.; Saenz-Agudelo, Pablo; Berumen, Michael L.; Jones, Geoffrey P.",The role of marine reserves in the replenishment of a locally impacted population of anemonefish on the Great Barrier Reef,.,.,"The development of parentage analysis to track the dispersal of juvenile offspring has given us unprecedented insight into the population dynamics of coral reef fishes. These tools now have the potential to inform fisheries management and species conservation, particularly for small fragmented populations under threat from exploitation and disturbance. In this study, we resolve patterns of larval dispersal for a population of the anemonefish Amphiprion melanopus in the Keppel Islands (southern Great Barrier Reef). Habitat loss and fishing appear to have impacted this population and a network of no-take marine reserves currently protects 75% of the potential breeders. Using parentage analysis, we estimate that 21% of recruitment in the island group was generated locally and that breeding adults living in reserves were responsible for 79% (31 of 39) of these of locally produced juveniles. Overall, the network of reserves was fully connected via larval dispersal; however, one reserve was identified as a critical source of larvae for the island group. The population in the Keppel Islands also appears to be well-connected to other source populations at least 60km away, given that 79% (145 of 184) of the juveniles sampled remained unassigned in the parentage analysis. We estimated the effective size of the A.melanopus metapopulation to be 745 (582-993 95% CI) and recommend continued monitoring of its genetic status. Maintaining connectivity with populations beyond the Keppel Islands and recovery of local recruitment habitat, potentially through active restoration of host anemone populations, will be important for its long-term persistence.",10,2016,10.1111/mec.13484,WOS:000369530000004,field,.,.,.,.,.,,.,.,.,.,,.,.,.,.,.,.,.,.,.,.,.,.,.,connectivity,.,.,.,.,.,.,.,,.,,.,.,.,.,,,.,,.,,.,.,.,.,,,,no control
207,out,out,out,WoS,.,J,"Dahlgren, C. P.; Buch, K.; Rechisky, E.; Hixon, M. A.","Dahlgren, C. P.; Buch, K.; Rechisky, E.; Hixon, M. A.",Multiyear Tracking of Nassau Grouper Spawning Migrations,.,.,"An understanding of temporal patterns of migration and spatial connectivity between home ranges and spawning sites is necessary for effective management of species that form transient spawning aggregations. The Nassau Grouper Epinephelus striatus is a Caribbean coral reef fish that displays such spawning aggregations, which have been overfished to the point of threatening the species. Using acoustic telemetry, we examined the size at which Nassau Grouper migrate to spawning aggregations, the timing of migrations, and the distance of migration routes used by Nassau Grouper from within and outside of a large, no-take marine reserve in the central Bahamas. Fish (total n = 19) were tagged in 2004 (n = 6) and 2005 (n = 13) and were tracked for one to four spawning seasons. Fish that were 54 cm TL or greater made spawning migrations, with all but one migrating southward along the shelf edge of Exuma Sound for a distance of 70 km to over 200 km, usually during the December full moon. Fish typically made one migration annually, which lasted from 1 to 3 weeks, with fish remaining at spawning sites for only 1-2 d; however, when the full moon was early in the spawning season, several fish remained away from their home reefs through two lunar cycles or delayed their migrations by a month, and one fish made two migrations. Fish that were migrating for the first time had slower swimming speeds to spawning sites than did experienced fish, but swimming speeds were similar between the two groups during return migrations, suggesting that their migration behavior was learned. Our results demonstrate that spawning migration patterns for this species may be more variable in The Bahamas than at other Caribbean locations. The present findings also have important implications for the management of the species, including increasing the minimum size limit to 54 cm or larger and the use of both marine protected areas and seasonal closures to rebuild the spawning stock.",11,2016,10.1080/19425120.2016.1223233,WOS:000390133700009,.,.,.,.,.,.,,.,.,.,.,,.,.,.,.,.,.,.,.,.,.,.,.,.,connectivity,.,.,.,.,.,.,.,,.,,.,.,.,.,,,.,,.,,.,.,.,.,,,,not relevant
208,in,out,out,WoS,yes,J,"Montoya-Maya, Phanor H.; Smit, Kaylee P.; Burt, April J.; Frias-Torres, Sarah","Montoya-Maya, Phanor H.; Smit, Kaylee P.; Burt, April J.; Frias-Torres, Sarah","Large-scale coral reef restoration could assist natural recovery in Seychelles, Indian Ocean",.,.,"The aim of ecological restoration is to establish self-sustaining and resilient systems. In coral reef restoration, transplantation of nursery-grown corals is seen as a potential method to mitigate reef degradation and enhance recovery. The transplanted reef should be capable of recruiting new juvenile corals to ensure long-term resilience. Here, we quantified how coral transplantation influenced natural coral recruitment at a large-scale coral reef restoration site in Seychelles, Indian Ocean. Between November 2011 and June 2014 a total of 24,431 nursery-grown coral colonies from 10 different coral species were transplanted in 5,225 m(2) (0.52 ha) of degraded reef at the no-take marine reserve of Cousin Island Special Reserve in an attempt to assist in natural reef recovery. We present the results of research and monitoring conducted before and after coral transplantation to evaluate the positive effect that the project had on coral recruitment and reef recovery at the restored site. We quantified the density of coral recruits (spat <1 cm) and juveniles (colonies 1-5 cm) at the transplanted site, a degraded control site and a healthy control site at the marine reserve. We used ceramic tiles to estimate coral settlement and visual surveys with 1 m2 quadrats to estimate coral recruitment. Six months after tile deployment, total spat density at the transplanted site (123.4 +/- 13.3 spat m(-2)) was 1.8 times higher than at healthy site (68.4 +/- 7.8 spat m(-2)) and 1.6 times higher than at degraded site (78.2 +/- 7.17 spat m(-2)). Two years after first transplantation, the total recruit density was highest at healthy site (4.8 +/- 0.4 recruits m(-2)), intermediate at transplanted site (2.7 +/- 0.4 recruits m(-2)), and lowest at degraded site (1.7 +/- 0.3 recruits m(-2)). The results suggest that large-scale coral restoration may have a positive influence on coral recruitment and juveniles. The effect of key project techniques on the results are discussed. This study supports the application of large-scale, science-based coral reef restoration projects with at least a 3-year time scale to assist the recovery of damaged reefs.",33,2016,10.3897/natureconservation.16.8604,WOS:000389654600001,field,,,,,,,,,,,,,,,,.,.,.,.,.,.,.,.,.,connectivity,.,.,.,.,.,.,.,,.,,.,.,.,.,,,.,,.,,.,.,.,.,,,,no MPA
209,in,out,out,WoS,yes,J,"Moustakas, Aristides","Moustakas, Aristides",The effects of marine protected areas over time and species' dispersal potential: a quantitative conservation conflict attempt,.,.,"Protected areas are an important conservation measure. However, there are controversial findings regarding whether closed areas are beneficial for species and habitat conservation as well as for harvesting. Species dispersal is acknowledged as a key factor for the design and impacts of protected areas. A series of agent-based models using random diffusion to model fish dispersal were run before and after habitat protection. All results were normalized without the protected habitat in each scenario to detect the relative difference after protecting an area, all else being equal. Model outputs were compared with published data regarding the impacts over time of MPAs on fish biomass. In addition, data on species' dispersal potential in terms of kilometres per year are compared with model outputs. Results show that fish landings of species with short dispersal rates will take longer to reach the levels from before the Marine Protected Areas (MPAs) were established than landings of species with long dispersal rates. Further, the establishment of an MPA generates a higher relative population source within the MPA for species with low dispersal abilities than for species with high dispersal abilities. Results derived here show that there exists a feasible win-win scenario that maximizes both fish biomass and fish catches.",2,2016,10.5194/we-16-113-2016,WOS:000422650100001,model,.,.,.,.,.,,.,.,.,.,,.,.,.,.,.,.,.,.,.,.,.,.,.,connectivity,.,.,.,.,.,.,.,,.,,.,.,.,.,,,.,,.,,.,.,.,.,,,,
210,in,in,out,WoS,yes,J,"Nakin, M. D. V.; McQuaid, C. D.","Nakin, M. D. V.; McQuaid, C. D.",Effects of marine reserves on the reproductive biology and recruitment rates of commonly and rarely exploited limpets,.,.,"We tested the effects of marine reserve status on the reproductive biology and recruitment rates of two commonly exploited (Helcion concolor, Scutellastra longicosta) and two rarely exploited (Cellana capensis, Scutellastra granularis) limpet species using two reserve and two non-reserve sites on the south coast of South Africa. Because densities of commonly exploited species are lower outside reserves, we hypothesised that limpets outside reserves will: (i) mature earlier; and (ii) show higher individual reproductive output. Rarely exploited species should show no such effects. For recruitment, we hypothesised that if recruits are attracted to adults or survive better where there are more adults, then commonly exploited (but not rarely exploited) species should show higher recruitment inside reserves. Analyses of gonadosomatic indices produced significant Month x Reserve interactions for all species (ANCOVA, p < 0.05), indicating inconsistent reserve effects even for exploited species, although months with significant differences occurred more often in the commonly exploited species, giving weak support to the hypothesis regarding reproductive output. Reserve status had no significant effect on sex ratios or size at sexual maturity for either sex of any species. Accordingly, reserves had only a minor influence on reproduction in these species, which might reflect an indirect effect of poor policing. The timing of major recruitment events differed among species, with two broad patterns: recruitment was sporadic for C. capensis and S. longicosta and protracted for H. concolor and S. granularis. Recruit densities showed strong site effects. Highest recruitment occurred at the exploited site, Xhora, with no reserve effects, except in a single month for C. capensis, indicating that recruitment is independent of whether the site is protected or not. Therefore, reserves do not enhance recruitment directly, but because these populations appear to be open on scales of tens of kilometres, generally higher densities of limpets within reserves could enhance overall recruitment, because of greater gamete output by the population. Accordingly, reserves might have an indirect 'spillover' effect on recruitment, if not a direct one.",0,2016,10.2989/1814232X.2016.1255255,WOS:000391853200009,field,CI,2002-2004,MPA,Dwesa-Cwebe,NA,,NA,NA,NA,NA,,NA,South Africa,temperate,Africa,Indian Ocean,NA,invertebrate,mix,mix,no,.,.,.,connectivity,.,recruitment,recruitment,figure 5,neutral,yes,number of individuals per m^2,.,.,.,.,.,.,.,,,.,,.,,.,.,.,.,,,,VARIANCE NOT PROVIDED
