295,out,out,out,WoS,.,J,"Cole, V. J.; McQuaid, C. D.; Nakin, M. D. V.","Cole, V. J.; McQuaid, C. D.; Nakin, M. D. V.","Marine protected areas export larvae of infauna, but not of bioengineering mussels to adjacent areas",.,.,"Populations of organisms that create habitat can often be fragmented throughout landscapes by anthropogenic disturbances such as harvesting and loss or change to the identity of such bioengineers may lead to large changes in biodiversity. Using the fauna associated with a bioengineer, the intertidal mussel Perna perna, we tested hypotheses about the relative importance of larval export from protected populations in marine reserves. Harvesting led to the replacement of P. perna and the domination of shores outside reserves by turf-forming coralline algae, mostly Corallina spp. We determined whether the diverse fauna recruiting onto artificial units of habitat placed within mussel beds differed between reserves and non-reserve areas or whether shores outside reserves, and open to harvesting, received recruits through larval export from reserves. Furthermore, we determined whether this was affected by the distance away from reserves and whether colonisation was achieved by movement of adults from surrounding biogenic habitats or via the plankton. Overall, we found no effect of increasing distance away from a reserve on the cover of adult mussels or associated fauna. We found strong effects of the presence of marine reserves on abundances of molluscs and polychaetes but not crustaceans. There were greater densities of molluscs in sites with a reserve (i.e. inside reserves, and up to 5 km outside reserve boundaries), but more polychaetes in exploited sites. For molluscs, this pattern was driven by gastropods rather than bivalves. Furthermore, although reserves had greater cover of adult mussels than non-reserve areas, recruitment of mussels was not greater inside or near to reserves. Our study illustrates the effectiveness of these reserves in protecting stocks of adult mussels, and although there was no evidence that reserves provided export of the larvae of mussels (the target species), they did provide larval export of non-targeted associated species. By protecting a harvested bioengineer and through export of the larvae of its associated fauna, these reserves fulfil some, but not all the conservation aims of a marine protected area. (C) 2011 Elsevier Ltd. All rights reserved.",12,2011,10.1016/j.biocon.2011.04.030,WOS:000292661200004,.,.,.,.,.,.,,.,.,.,.,,.,.,.,.,.,.,.,.,.,.,.,.,.,connectivity,.,.,.,.,.,.,.,,.,,.,.,.,.,,,.,,.,,.,.,.,.,,,,not relevant
296,out,out,out,WoS,.,J,"Coleman, Melinda A.; Chambers, Justine; Knott, Nathan A.; Malcolm, Hamish A.; Harasti, David; Jordan, Alan; Kelaher, Brendan P.","Coleman, Melinda A.; Chambers, Justine; Knott, Nathan A.; Malcolm, Hamish A.; Harasti, David; Jordan, Alan; Kelaher, Brendan P.",Connectivity within and among a Network of Temperate Marine Reserves,.,.,"Networks of marine reserves are increasingly being promoted as a means of conserving marine biodiversity. One consideration in designing systems of marine reserves is the maintenance of connectivity to ensure the long-term persistence and resilience of populations. Knowledge of connectivity, however, is frequently lacking during marine reserve design and establishment. We characterise patterns of genetic connectivity of 3 key species of habitat-forming macroalgae across an established network of temperate marine reserves on the east coast of Australia and the implications for adaptive management and marine reserve design. Connectivity varied greatly among species. Connectivity was high for the subtidal macroalgae Ecklonia radiata and Phyllospora comosa and neither species showed any clear patterns of genetic structuring with geographic distance within or among marine parks. In contrast, connectivity was low for the intertidal, Hormosira banksii, and there was a strong pattern of isolation by distance. Coastal topography and latitude influenced small scale patterns of genetic structure. These results suggest that some species are well served by the current system of marine reserves in place along this temperate coast but it may be warranted to revisit protection of intertidal habitats to ensure the long-term persistence of important habitat-forming macroalgae. Adaptively managing marine reserve design to maintain connectivity may ensure the long-term persistence and resilience of marine habitats and the biodiversity they support.",52,2011,10.1371/journal.pone.0020168,WOS:000291005200041,.,.,.,.,.,.,,.,.,.,.,,.,.,.,.,.,.,.,.,.,.,.,.,.,connectivity,.,.,.,.,.,.,.,,.,,.,.,.,.,,,.,,.,,.,.,.,.,,,,no control
297,out,out,out,WoS,.,J,"Moustakas, Aristides; Silvert, William","Moustakas, Aristides; Silvert, William",Spatial and temporal effects on the efficacy of marine protected areas: implications from an individual based model,.,.,"We have developed a spatially explicit model that simulates the interaction between fish and fishers based on past fish location, abundance and fish dispersal. We have examined four scenarios for the design and management of Marine Protected Areas (MPA) and for each we simulated fish biomass and fish catches: (1) No MPA. (2) A single MPA located at a feeding area. (3) A single MPA designed to maximise its overlap with the predominant route of fish dispersal. (4) The use of two MPAs. Each scenario was replicated with two scenarios regarding the time that fish remains within the MPA and two grid map scenarios to account for time-space effects and map/coastline characteristics. Results showed that overall closing an area increased fish biomass. However, an MPA located in the open sea for a limited time may have adverse effects on fish biomass. MPAs increased fish catches when a single large MPA or two small MPAs were located in the open sea for a limited time. The effects of time that fish remains protected in closed areas vary in combination with the spatial design: When examining time effects on the efficacy of MPAs within each scenario with an MPA located in the open sea, fish biomass was always higher in the case where fish was protected for more calendar days during each year. When comparing between different spatial designs, proximity to the coast was a more predominant factor in the efficacy of MPAs rather than time that fish was protected. The scenario that gave the highest total fish biomass was the one that covered the largest part of the migration route, despite increased edge effects. Our results suggest that it is not per se the perimeter to surface ratio that matters, but the trade-off between edge effects and maximised MPA surface in the predominant dispersal direction. Our results also have implications for the design of terrestrial reserves.",12,2011,10.1007/s00477-010-0411-2,WOS:000287592200010,.,.,.,.,.,.,,.,.,.,.,,.,.,.,.,.,.,.,.,.,.,.,.,.,connectivity,.,.,.,.,.,.,.,,.,,.,.,.,.,,,.,,.,,.,.,.,.,,,,not relevant
298,out,out,out,WoS,.,B,"Beaulieu, Stace E.; Mills, Susan; Mullineaux, Lauren; Watanabe, Hiromi; Pradillon, Florence; Kojima, Shigeaki","Beaulieu, Stace E.; Mills, Susan; Mullineaux, Lauren; Watanabe, Hiromi; Pradillon, Florence; Kojima, Shigeaki",International study of larval dispersal and population connectivity at hydrothermal vents in the US Marianas Trench Marine National Monument,.,.,"Deep-sea, chemosynthesis-based ecosystems, such as hydrothermal vents, have received increasing attention in the past decade for protection of biodiversity and ecosystem function. For these spatially discrete habitats, dispersal of larvae in the plankton, settlement to the seafloor, and recruitment are processes that connect populations of benthic fauna. Knowledge of these processes is vital to understanding the resilience of vent ecosystems to disturbance or removal of sources of propagules. In particular, hydrothermal vents may be impacted by human activities including scientific research, eco-tourism, bioprospecting, and polymetallic sulfide mining. In 2009 the first Marine Protected Area (MPA) for vents in the U. S. EEZ was established as part of the Marianas Trench Marine National Monument (MTMNM). The vents in this region are located along the Mariana back-arc spreading center (BASC) and volcanic arc.In 2010 we conducted the first cruise dedicated to the study of vent-endemic fauna at the southern Mariana BASC. Cruise YK10-11 on R/V Yokosuka was one of several to this region as part of the Japanese multi-disciplinary program TAIGA (Trans-crustal Advection and In-situ biogeochemical processes of Global sub-sea floor Aquifer). Larval, juvenile, and adult specimens of benthic invertebrates were collected at vents on-axis (Snail, Yamanaka) and off-axis (Archaean, Urashima, Pika) at similar to 3000-m depth. Our objectives included characterization of benthic communities, assessments of larval abundance and diversity, estimates of local-scale larval dispersal (on the order of 10 km), shipboard visualization of larval swimming behavior, and genetic diversity of populations at each vent site and genetic deviation between sites. Operations during the cruise included nine dives with the submersible Shinkai 6500 and seven deployments of subsurface moorings.These vents on the southern Mariana BASC appear to have similar macrofaunal community composition to the better-studied BASC vents similar to 600-km to the north. Benthic collections included gastropods (e. g., Alviniconcha hessleri, Phymorhynchus aff. starmeri, Shinkailepas aff. kaikatensis), barnacles (Neoverruca brachylepadoformis), shrimp (Chorocaris aff. vandoverae), and polychaetes (e. g., Paralvinella hessleri); larvae were also collected near-bottom with a slurp sampler. To further assess larval abundance and diversity, we deployed large-volume plankton pumps near three of the vents, filtering five samples of similar to 40000 L each over a 63-mu m mesh. Larvae were sorted morphologically, and selected morphotypes were identified via genetic bar-coding to phylotype and, when possible, to species. The local-scale larval dispersal study included a current meter recording near-bottom flow on-axis during the cruise. For the larval behavioral study, individual polychaete, barnacle, and gastropod larvae of several species were visualized in horizontally-and vertically-oriented chambers to measure swimming speeds at 1 atm. Local-scale population connectivity is being determined via molecular genetic analyses of mainly the benthic specimens. The population genetic study may be extended to the regional scale when linked to other analyses for specimens collected at vents elsewhere in the MTMNM, including those relatively nearby along the Mariana arc and further north on the BASC.Results of our study of larval dispersal and population connectivity at these deep-sea vents will be considered in the context of ecosystem management and protection in the MTMNM. Our work will also be considered in the broader context of connectivity of deep-sea, chemosynthesis-based ecosystems, through our involvement with the International Network for Scientific Investigations of Deep-Sea Ecosystems (INDEEP) working group on population connectivity.",0,2011,.,WOS:000299005800167,.,.,.,.,.,.,,.,.,.,.,,.,.,.,.,.,.,.,.,.,.,.,.,.,connectivity,.,.,.,.,.,.,.,,.,,.,.,.,.,,,.,,.,,.,.,.,.,,,,not relevant
299,in,out,.,WoS,yes,J,Diaz,"Diaz, David; Mallol, Sandra; Parma, Ana M.; Goni, Raquel",Decadal trend in lobster reproductive output from a temperate marine protected area,.,.,"Increased recruitment from eggs and larvae exported from marine protected areas (MPAs) is anticipated to produce much greater benefits for exploited populations than spillover of adults. However, resolving the link between local egg production and regional recruitment is beyond current research capabilities, and quantifying the contribution of the MPA to regional reproductive output is the first step towards evaluating such potential. In this study, we assessed the egg production of spiny lobsters Palinurus elephas in the Columbretes MPA (western Mediterranean, Spain) and its contribution to regional reproductive output over the decade corresponding to years 10 to 19 of protection. We show that: (1) Mean female fecundity in the MPA increased by 41% over the 10 yr of study and in recent years was more than twice the fecundity in the nearby fished areas. (2) At the end of the study, mature females were on average 20 times more abundant, and egg production per unit area was 30 times greater in the MPA than in nearby fished areas. (3) At that time, the MPA, occupying 18% of the regional lobster habitats, was responsible for over 80% of the regional egg production. Overall, we estimate that after nearly 2 decades of protection, regional egg production was 6 times greater than would have been without the MPA. When compared to a net benefit through biomass spillover from the MPA to the regional lobster fishery of + 11% of the annual catch, a 6-fold increase in egg production suggests that egg and larval export have far greater potential than spillover to benefit exploited populations.",18,2011,10.3354/meps09182,WOS:000292890400012,field,CI,1997-2009,MPA,Columbretes Islands,19,old,1990,moderately,55,55,medium,yes,Spain,temperate,Europe,Mediterranean sea,mix,invertebrate,Palinurus elephas,fished,NA,.,.,.,connectivity,.,.,mean fecundity,figure 2,positive,yes,number of eggs per female (*10^4),se,11.123456,11.5,3.63E-01,1.2300447,5.481108312,68.4,2.82E-01,2.333219335,.,.,.,.,.,.,.,.,.,0.707748705,0.003712543,out because egg density better reflects reproductive potential in this same article
299,in,out,out,WoS,yes,J,"Diaz, David; Mallol, Sandra; Parma, Ana M.; Goni, Raquel","Diaz, David; Mallol, Sandra; Parma, Ana M.; Goni, Raquel",Decadal trend in lobster reproductive output from a temperate marine protected area,.,.,"Increased recruitment from eggs and larvae exported from marine protected areas (MPAs) is anticipated to produce much greater benefits for exploited populations than spillover of adults. However, resolving the link between local egg production and regional recruitment is beyond current research capabilities, and quantifying the contribution of the MPA to regional reproductive output is the first step towards evaluating such potential. In this study, we assessed the egg production of spiny lobsters Palinurus elephas in the Columbretes MPA (western Mediterranean, Spain) and its contribution to regional reproductive output over the decade corresponding to years 10 to 19 of protection. We show that: (1) Mean female fecundity in the MPA increased by 41% over the 10 yr of study and in recent years was more than twice the fecundity in the nearby fished areas. (2) At the end of the study, mature females were on average 20 times more abundant, and egg production per unit area was 30 times greater in the MPA than in nearby fished areas. (3) At that time, the MPA, occupying 18% of the regional lobster habitats, was responsible for over 80% of the regional egg production. Overall, we estimate that after nearly 2 decades of protection, regional egg production was 6 times greater than would have been without the MPA. When compared to a net benefit through biomass spillover from the MPA to the regional lobster fishery of + 11% of the annual catch, a 6-fold increase in egg production suggests that egg and larval export have far greater potential than spillover to benefit exploited populations.",18,2011,10.3354/meps09182,WOS:000292890400012,field,CI,1997-2009,MPA,Columbretes Islands,19,,1990,FPA,55,55,,yes,Spain,temperate,Europe,Mediterranean sea,mix,invertebrate,Palinurus elephas,fished,NA,,,,connectivity,,.,size of females,figure 3,NA,yes,number,,,,,,,,,,,,,,,,,,,,,unrelevant indicator
299,in,in,in,WoS,yes,J,Diaz,"Diaz, David; Mallol, Sandra; Parma, Ana M.; Goni, Raquel",Decadal trend in lobster reproductive output from a temperate marine protected area,.,.,"Increased recruitment from eggs and larvae exported from marine protected areas (MPAs) is anticipated to produce much greater benefits for exploited populations than spillover of adults. However, resolving the link between local egg production and regional recruitment is beyond current research capabilities, and quantifying the contribution of the MPA to regional reproductive output is the first step towards evaluating such potential. In this study, we assessed the egg production of spiny lobsters Palinurus elephas in the Columbretes MPA (western Mediterranean, Spain) and its contribution to regional reproductive output over the decade corresponding to years 10 to 19 of protection. We show that: (1) Mean female fecundity in the MPA increased by 41% over the 10 yr of study and in recent years was more than twice the fecundity in the nearby fished areas. (2) At the end of the study, mature females were on average 20 times more abundant, and egg production per unit area was 30 times greater in the MPA than in nearby fished areas. (3) At that time, the MPA, occupying 18% of the regional lobster habitats, was responsible for over 80% of the regional egg production. Overall, we estimate that after nearly 2 decades of protection, regional egg production was 6 times greater than would have been without the MPA. When compared to a net benefit through biomass spillover from the MPA to the regional lobster fishery of + 11% of the annual catch, a 6-fold increase in egg production suggests that egg and larval export have far greater potential than spillover to benefit exploited populations.",18,2011,10.3354/meps09182,WOS:000292890400012,field,CI,1997-2009,MPA,Columbretes Islands,19,old,1990,moderately,55,55,medium,yes,Spain,subtropical,Europe,Mediterranean sea,mix,invertebrate,Palinurus elephas,fished,NA,,,,connectivity,,reproductive potential,egg density,figure 4,positive,yes,number of eggs per unit area (*10^5),se,1.0095238,11.5,0.2190476,0.7428266,0.057142857,68.4,1.90E-02,0.157531986,.,.,.,.,.,.,.,.,.,2.871679618,0.158191922,.
300,out,out,out,WoS,.,S,"Graham, Nicholas A. J.; Ainsworth, Tracy D.; Baird, Andrew H.; Ban, Natalie C.; Bay, Line K.; Cinner, Joshua E.; De Freitas, Debora M.; Diaz-Pulido, Guillermo; Dornelas, Maria; Dunn, Simon R.; Fidelman, Pedro I. J.; Foret, Sylvain; Good, Tatjana C.; Kool, Johnathan; Mallela, Jennie; Penin, Lucie; Pratchett, Morgan S.; Williamson, David H.","Graham, Nicholas A. J.; Ainsworth, Tracy D.; Baird, Andrew H.; Ban, Natalie C.; Bay, Line K.; Cinner, Joshua E.; De Freitas, Debora M.; Diaz-Pulido, Guillermo; Dornelas, Maria; Dunn, Simon R.; Fidelman, Pedro I. J.; Foret, Sylvain; Good, Tatjana C.; Kool, Johnathan; Mallela, Jennie; Penin, Lucie; Pratchett, Morgan S.; Williamson, David H.",FROM MICROBES TO PEOPLE: TRACTABLE BENEFITS OF NO-TAKE AREAS FOR CORAL REEFS,.,.,"The number of no-take marine protected areas (here referred to as no-take areas, NTAs) on coral reefs has increased considerably in recent decades. Coincident with accelerating degradation of coral reefs, expectations of the benefits that NTAs can provide for coastal societies and sustainability of marine ecosystems has grown. These include increasing abundance of reef organisms both inside and outside NTAs, protecting key ecosystem functions, and providing social and economic benefits through improved fisheries and tourism. However, there is a lack of convincing evidence for many of these expectations. This is the first attempt to synthesize all potential costs and benefits of coral reef NTAs and critically examine evidence of their impacts on both ecosystems and societies. NTAs with high compliance consistently increase the diversity, density and biomass of exploited reef fishes and certain groups of motile invertebrates within their boundaries and have benefits for reef-associated tourism. Some NTAs provide small increases in the abundance of corals and decreases in macroalgal cover. The effects of NTAs on genetic diversity and connectivity among meta-populations are variable or as yet unquantified. There is limited evidence of NTAs providing social benefits through increased fishery yields and tourism revenue. There are examples of both positive and negative effects on social well-being. Finally, sharks, marine megafauna and microbial communities showed few tangible benefits from NTAs. Substantial gaps in the science of coral reef NTAs remain, especially in their capacity to provide socioeconomic benefits. A crucial research priority is understanding how the cumulative effects of climate change will influence the various benefits that NTAs provide. To be effective, NTAs must be used in conjunction with a range of other management tools and applied according to local environmental and societal contexts.",59,2011,.,WOS:000293419200003,.,.,.,.,.,.,,.,.,.,.,,.,.,.,.,.,.,.,.,.,.,.,.,.,connectivity,.,.,.,.,.,.,.,,.,,.,.,.,.,,,.,,.,,.,.,.,.,,,,not relevant
301,out,out,out,WoS,yes,J,"Miyake, Yoichi; Kimura, Shingo; Kawamura, Tomohiko; Kitagawa, Takashi; Takahashi, Tetsuya; Takami, Hideki","Miyake, Yoichi; Kimura, Shingo; Kawamura, Tomohiko; Kitagawa, Takashi; Takahashi, Tetsuya; Takami, Hideki",Population connectivity of Ezo abalone on the northern Pacific coast of Japan in relation to the establishment of harvest refugia,.,.,"Population connectivity among 7 fishery grounds of Ezo abalone Haliotis discus hannai on the northern Miyagi coast (approximately 80 km) was investigated using hydrodynamic and particle-tracking models. The objectives were to: (1) clarify the larval dispersal processes, (2) quantify the dispersal distance of larvae and (3) estimate the population connectivity. To simulate larval dispersal, particles were released at the timings of spawning estimated from the shell lengths of newly settled abalone. The larval dispersal was simulated for 2 periods. The modeled hydrodynamics in the first period simulated stormy conditions because of the passage of a low-pressure system whereas that in the second period simulated relatively calm conditions. In the first period, the spawning appeared to be triggered by the low-pressure system, and the larval dispersal was estimated to be generally greater than that in the second period. The mean dispersal distances were less than 40 km in both periods. Model results indicate that abalone in the fishery grounds on the mid-and southern coast exhibit 2 distinct larval dispersal patterns. The number of connected sites was 3 to 7 and 2 to 4 in the stormy and relatively calm conditions, respectively. The calmer hydrodynamic conditions were favorable for self-replenishment. Self-recruitment was usually greater than the connectivity with the other fishery grounds; however, poor self-recruitment occurred in some fishery grounds. This implies that the restocking and protection of local resources do not always lead to an increase in local recruitment, and it is necessary to investigate the larval dispersal processes from each larval source for successful management.",12,2011,10.3354/meps09348,WOS:000296391900012,model,.,.,.,.,.,,.,.,.,.,,.,.,.,.,.,.,.,.,.,.,.,.,.,connectivity,.,.,.,.,.,.,.,,.,,.,.,.,.,,,.,,.,,.,.,.,.,,,,model and no MPA
302,in,out,out,WoS,yes,J,"Chae, Dong-Ryul; ???","Chae, Dong-Ryul; ???",A study on Marine Protected Areas as Fisheries Management Tools,.,.,"Marine protected Areas(MPAs) are specially designated zones of the sea that are designed to secure operation of ecosystem function and to restore marine ecosystem to the original state by excluding all detrimental human activities. MPAs have been proposed in many countries as means of realizing sustainable fisheries and recently MPAs are newly receiving attention as precautionary measure for global warming and climate change. The purpose of this paper is to examine the possibility of MPAs as fisheries management tools through a wide range of literature analysis and to suggest necessity of fisheries purpose of MPAs in Korea.Establishment of marine protected area can accompany various economic benefits such as restoration of marine environment, preservation of habitats, promotion of marine tourism and so on. Especially, a lot of case studies suggested that MPAs may bring out benefits to the fishing industry as a result of enhanced stocks.Fisheries benefits of MPAs on targeted species include increased abundance, increased mean individual size and age, increased reproductive output, enhanced recruitment inside and outside refuge, maintenance of genetic diversity of stocks, and enhanced fishery yields in adjacent fishing grounds, so called spill-over.MPAs for ecosystem conservation and protection of coastal wetland have been applied appropriately and effectively, however, the Korean MPAs system is still detective due to absence of fisheries purpose MPAs.Finally, suggestions for Korean MPAs can be summarized as following four recommendations; to establish number of small-scale MPAs rather than few large MPAs, to designate island and its surrounding areas as reserve, to consider MPA design with stock enhancement program, and to undertake co-management with Eochon-Gye, the traditional coastal community in Korea.",0,2011,.,KJD:ART001620893,.,.,.,.,.,.,,.,.,.,.,,.,.,.,.,.,.,.,.,.,.,.,.,.,connectivity,.,.,.,.,.,.,.,,.,,.,.,.,.,,,.,,.,,.,.,.,.,,,,not available in english
